{
  "profession": "data-scientist",
  "specialization": "general",
  "seniority": "junior",
  "sectionOrder": ["summary", "education", "skills", "projects", "experience"],
  "keywords": [
    "python",
    "r",
    "sql",
    "pandas",
    "numpy",
    "statistics",
    "probability",
    "data-visualization",
    "matplotlib",
    "seaborn",
    "tableau",
    "power-bi",
    "data-cleaning",
    "exploratory-data-analysis",
    "hypothesis-testing",
    "machine-learning-basics"
  ],
  "bulletConstraints": {
    "summaryMaxLines": 4,
    "experienceMaxLines": 6,
    "educationMaxLines": 10,
    "skillsMaxLines": 10,
    "projectsMaxLines": 8
  },
  "active": true,
  "metadata": {
    "version": "1.0.0",
    "created": "2026-01-31T00:00:00Z",
    "atsCompatible": true
  }
}
