{
  "profession": "finance",
  "specialization": "leadership",
  "seniority": "senior",
  "sectionOrder": ["summary", "experience", "leadership", "skills", "education"],
  "keywords": [
    "financial-strategy",
    "business-partnering",
    "executive-reporting",
    "capital-allocation",
    "risk-management",
    "governance",
    "compliance",
    "board-presentations",
    "stakeholder-management",
    "cash-management",
    "mna",
    "cost-reduction",
    "profitability-improvement"
  ],
  "bulletConstraints": {
    "summaryMaxLines": 6,
    "experienceMaxLines": 16,
    "educationMaxLines": 6,
    "skillsMaxLines": 10,
    "projectsMaxLines": 8
  },
  "active": true,
  "metadata": {
    "version": "1.0.0",
    "created": "2026-01-31T00:00:00Z",
    "atsCompatible": true
  }
}
