{
  "profession": "software-engineer",
  "specialization": "fullstack",
  "seniority": "mid-level",
  "sectionOrder": ["summary", "experience", "projects", "skills", "education"],
  "keywords": [
    "fullstack",
    "react",
    "nodejs",
    "typescript",
    "docker",
    "kubernetes",
    "microservices",
    "rest-api",
    "graphql",
    "sql",
    "nosql",
    "mongodb",
    "postgresql",
    "ci-cd",
    "jenkins",
    "github-actions",
    "performance-optimization",
    "code-review",
    "mentoring",
    "agile",
    "scrum"
  ],
  "bulletConstraints": {
    "summaryMaxLines": 5,
    "experienceMaxLines": 12,
    "educationMaxLines": 6,
    "skillsMaxLines": 10,
    "projectsMaxLines": 8
  },
  "active": true,
  "metadata": {
    "version": "1.0.0",
    "created": "2026-01-31T00:00:00Z",
    "atsCompatible": true
  }
}
