{
  "profession": "data-scientist",
  "specialization": "machine-learning",
  "seniority": "mid-level",
  "sectionOrder": ["summary", "experience", "projects", "skills", "education"],
  "keywords": [
    "machine-learning",
    "supervised-learning",
    "unsupervised-learning",
    "feature-engineering",
    "model-deployment",
    "mlops",
    "tensorflow",
    "pytorch",
    "scikit-learn",
    "xgboost",
    "airflow",
    "spark",
    "big-data",
    "a-b-testing",
    "experimentation",
    "model-evaluation",
    "precision",
    "recall",
    "roc-auc",
    "docker"
  ],
  "bulletConstraints": {
    "summaryMaxLines": 5,
    "experienceMaxLines": 12,
    "educationMaxLines": 6,
    "skillsMaxLines": 12,
    "projectsMaxLines": 10
  },
  "active": true,
  "metadata": {
    "version": "1.0.0",
    "created": "2026-01-31T00:00:00Z",
    "atsCompatible": true
  }
}
