{
  "profession": "software-engineer",
  "specialization": "general",
  "seniority": "junior",
  "sectionOrder": ["summary", "education", "skills", "experience", "projects"],
  "keywords": [
    "python",
    "javascript",
    "java",
    "sql",
    "git",
    "rest-api",
    "unit-testing",
    "debugging",
    "data-structures",
    "algorithms",
    "object-oriented-programming",
    "version-control",
    "agile",
    "problem-solving",
    "team-collaboration"
  ],
  "bulletConstraints": {
    "summaryMaxLines": 4,
    "experienceMaxLines": 6,
    "educationMaxLines": 8,
    "skillsMaxLines": 8,
    "projectsMaxLines": 6
  },
  "active": true,
  "metadata": {
    "version": "1.0.0",
    "created": "2026-01-31T00:00:00Z",
    "atsCompatible": true
  }
}
