{
  "profession": "finance",
  "specialization": "fp-a",
  "seniority": "mid-level",
  "sectionOrder": ["summary", "experience", "skills", "education", "projects"],
  "keywords": [
    "fp-a",
    "financial-planning",
    "forecasting",
    "budget-management",
    "scenario-analysis",
    "cash-flow",
    "pnl",
    "balance-sheet",
    "kpi-dashboards",
    "stakeholder-reporting",
    "variance-analysis",
    "cost-optimization"
  ],
  "bulletConstraints": {
    "summaryMaxLines": 5,
    "experienceMaxLines": 12,
    "educationMaxLines": 6,
    "skillsMaxLines": 10,
    "projectsMaxLines": 6
  },
  "active": true,
  "metadata": {
    "version": "1.0.0",
    "created": "2026-01-31T00:00:00Z",
    "atsCompatible": true
  }
}
